{
  "dossier_id": "D-PILOTE-RES-001",
  "step": "data-facts",
  "artifact": "source_index.json",
  "sources": [
    {
      "source_id": "SRC-VENTE-001"
    },
    {
      "source_id": "SRC-VENTE-002"
    },
    {
      "source_id": "SRC-VENTE-003"
    },
    {
      "source_id": "SRC-INSPECTION-001"
    },
    {
      "source_id": "SRC-PHOTO-001"
    }
  ],
  "source_fixture": "case_pilote_residentiel_standard.json"
}